{
  "$schema": "https://axm.sh/schemas/skill.schema.json",
  "owner": "@craigsmitham",
  "type": "skill",
  "name": "quick-change",
  "version": "0.1.0",
  "description": "Produces one Change Specification and Change Design together, reconciles their exact revisions, and returns a Change coordination handoff",
  "keywords": [
    "quick-change",
    "combined-specification-design",
    "change-specification",
    "change-design",
    "change-coherence",
    "bugfix",
    "gen-stack"
  ],
  "publish": {
    "ignore": []
  },
  "repository": {
    "type": "git",
    "url": "https://github.com/craigsmitham/agent-extensions",
    "directory": "skills/quick-change"
  },
  "homepage": "https://github.com/craigsmitham/agent-extensions",
  "license": "MIT",
  "recommendedPacks": [
    "@craigsmitham/packs/gen-stack"
  ],
  "standalone": false
}
