{
  "$schema": "https://axm.sh/schemas/skill.schema.json",
  "owner": "@agentxm",
  "type": "skill",
  "name": "agent-extension-engineering",
  "version": "0.2.0",
  "description": "Routes extension design, authoring, review, and maintenance requests to focused knowledge guidance",
  "license": "MIT",
  "repository": {
    "type": "git",
    "url": "https://github.com/agentxm/axm",
    "directory": "skills/agent-extension-engineering"
  },
  "keywords": ["agent-extensions", "engineering", "skills", "instructions", "knowledge", "packs"],
  "recommendedPacks": ["@agentxm/packs/agent-extension-engineering"],
  "standalone": false,
  "publish": {
    "exclude": ["/AGENTS.md"]
  }
}
