{
  "$schema": "https://axm.sh/schemas/skill.schema.json",
  "owner": "@craigsmitham",
  "type": "skill",
  "name": "design",
  "version": "0.3.0",
  "description": "Develops the canonical Change Design for one Change and reconciles it with the exact Change Specification",
  "keywords": [
    "design",
    "pitch",
    "solution-design",
    "change-design",
    "architecture",
    "tradeoffs",
    "evaluation-realization",
    "implementation-conformance",
    "gen-stack"
  ],
  "publish": {
    "ignore": []
  },
  "repository": {
    "type": "git",
    "url": "https://github.com/craigsmitham/agent-extensions",
    "directory": "skills/design"
  },
  "homepage": "https://github.com/craigsmitham/agent-extensions",
  "license": "MIT",
  "recommendedPacks": [
    "@craigsmitham/packs/gen-stack"
  ],
  "standalone": false
}
